### ISSUE TITLE
egg框架无响应

### ISSUE THREAD

**Issue by vicinibike** [eggjs/egg#3609]
## What happens?
部署于egg框架上的服务突然间无响应，接收不了任务请求，DEBUG模式下没有任务请求日志。 重启服务后恢复正常。

## 最小可复现仓库
线上出现过一次，之后在测试环境中尝试复现没有成功

## 相关配置

    logger: {
      level: 'DEBUG',
      dir: '/logs/eggjs/'+appInfo.name
    },

## 业务场景

	通过Nginx反向代理至业务服务，使用内网IP。 业务服务是基于egg框架开发的api接口

## 排查情况
	1. 在Nginx服务器上ping, telnet业务服务器，一切正常
	2. 在业务服务器上通过PS命令查看业务是否存活，一切正常
	3. 在业务服务器上通过netstat命令查看业务所监听端口是否存活，一切正常
	4. 在业务服务器上通过tcpdump抓包，可以正常收到nginx反向代理至该业务所监听的9907端口报文，报文内容如下：

		06:38:16.223802 IP ip-Nginx-IP.43306 > ip-业务服务器IP.9907: Flags [S], seq 1057135018, win 26883, options [mss 8961,sackOK,TS val 2883489482 ecr 0,nop,wscale 7], length 0
		06:38:16.223817 IP ip-业务服务器IP.9907 > ip-Nginx-IP.43306: Flags [S.], seq 3866541459, ack 1057135019, win 26847, options [mss 8961,sackOK,TS val 3277398453 ecr 2883489482,nop,wscale 7], length 0
		06:38:16.224752 IP ip-Nginx-IP.43306 > ip-业务服务器IP.9907: Flags [.], ack 1, win 211, options [nop,nop,TS val 2883489483 ecr 3277398453], length 0
		06:38:16.224813 IP ip-Nginx-IP.43306 > ip-业务服务器IP.9907: Flags [P.], seq 1:3874, ack 1, win 211, options [nop,nop,TS val 2883489483 ecr 3277398453], length 3873
		06:38:16.224817 IP ip-业务服务器IP.9907 > ip-Nginx-IP.43306: Flags [.], ack 3874, win 350, options [nop,nop,TS val 3277398454 ecr 2883489483], length 0
		06:38:31.222858 IP ip-Nginx-IP.43306 > ip-业务服务器IP.9907: Flags [F.], seq 3874, ack 1, win 211, options [nop,nop,TS val 2883504481 ecr 3277398454], length 0
		06:38:31.222989 IP ip-业务服务器IP.9907 > ip-Nginx-IP.43306: Flags [F.], seq 1, ack 3875, win 350, options [nop,nop,TS val 3277413452 ecr 2883504481], length 0
		06:38:31.223908 IP ip-Nginx-IP.43306 > ip-业务服务器IP.9907: Flags [.], ack 2, win 211, options [nop,nop,TS val 2883504482 ecr 3277413452], length 0

	5.查看业务日志，没有记录下任务请求信息、异常信息

## 相关环境信息
- **操作系统**：
Linux version 4.14.77-81.59.amzn2.x86_64 (mockbuild@ip-10-0-1-59) (gcc version 7.3.1 20180303 (Red Hat 7.3.1-5) (GCC)) #1 SMP Mon Nov 12 21:32:48 UTC 2018
- **Node 版本**：
v8.11.4
- **Egg 版本**：
"egg": "^2.2.1",

**Comment by atian25** [comment]
在服务器上 curl 看看呗。另外看看 Alinode 有没有什么信息

无法复现的没法跟踪。

**Comment by atian25** [comment]
hey, we need more information to follow up this issue, recommend using `npm init egg --type=simple` to provide a mini project and upload to your GitHub.

for now, it will close due to lack of activity, feel free to reopen this issue if provided more information.
